<?xml version="1.0" encoding="UTF-8"?>
<!-- edited with XMLSpy v2021 rel. 3 (x64) (http://www.altova.com) by Nick Todd (Conygre Consultants) -->
<xs:schema xmlns:xs="http://www.w3.org/2001/XMLSchema" elementFormDefault="qualified" attributeFormDefault="unqualified">
	<xs:element name="albums">
		<xs:annotation>
			<xs:documentation>Comment describing your root element</xs:documentation>
		</xs:annotation>
		<xs:complexType>
			<xs:sequence>
				<xs:element name="album" maxOccurs="unbounded">
					<xs:complexType>
						<xs:sequence>
							<xs:element name="id" type="xs:positiveInteger" minOccurs="0"/>
							<xs:element name="title" type="xs:string"/>
							<xs:element name="artist" type="xs:string"/>
							<xs:element name="price" type="xs:double"/>
							<xs:element name="tracks" minOccurs="0">
								<xs:complexType>
									<xs:sequence>
										<xs:element name="track" type="xs:string" maxOccurs="unbounded"/>
									</xs:sequence>
								</xs:complexType>
							</xs:element>
						</xs:sequence>
					</xs:complexType>
				</xs:element>
			</xs:sequence>
		</xs:complexType>
	</xs:element>
</xs:schema>